{
  "provider_id": "com.example.provider.echo",
  "provider_version": "1",
  "supported_contract_versions": [
    "0.1"
  ],
  "supported_vcp_versions": [
    "draft"
  ],
  "capabilities": [
    {
      "capability_id": "com.example.execution.echo",
      "capability_version": "1",
      "input_schema": {
        "type": "string"
      },
      "output_schema": {
        "type": "string"
      },
      "config_schema": {
        "type": "object",
        "additionalProperties": false
      },
      "lifecycle_features": {
        "streaming": true,
        "cancellation": true,
        "deadlines": true,
        "resource_reporting": true
      }
    },
    {
      "capability_id": "com.example.policy.evaluate",
      "capability_version": "1",
      "input_schema": {
        "type": "string"
      },
      "output_schema": {
        "type": "string"
      },
      "config_schema": {
        "type": "object",
        "additionalProperties": false
      },
      "lifecycle_features": {
        "streaming": true,
        "cancellation": true,
        "deadlines": true,
        "resource_reporting": true
      }
    },
    {
      "capability_id": "com.example.execution.echo",
      "capability_version": "2",
      "input_schema": {
        "type": "string"
      },
      "output_schema": {
        "type": "string"
      },
      "config_schema": {
        "type": "object",
        "additionalProperties": false
      },
      "lifecycle_features": {
        "streaming": true,
        "cancellation": true,
        "deadlines": true,
        "resource_reporting": true
      }
    }
  ]
}
